{
  "schemaVersion": "1.0.0",
  "policy": {
    "policyId": "negotiation-v1",
    "policyVersion": "1.0.0"
  },
  "input": {
    "conditionReportAcknowledged": true,
    "customerOfferCents": 2299999,
    "floorPriceCents": 2300000,
    "listPriceCents": 2500000,
    "maxOffers": 4,
    "offerNumber": 1,
    "policyEffectiveAt": "2026-01-01T00:00:00Z",
    "schemaVersion": "1.0.0",
    "sessionId": "session-synthetic-01",
    "vehicleId": "vehicle-synthetic-01"
  },
  "verificationProfileId": "ddn-wasm-v1"
}
